{
  "schema_version": 1,
  "os_type": "windows",
  "agent_version": "0.1.0",
  "system": {
    "manufacturer": "Dell Inc.",
    "model": "OptiPlex 7010",
    "serial_number": "SAMPLE7X",
    "hardware_uuid": "4C4C4544-0053-4D10-8050-B7C04F4D3258",
    "hostname": "AGY-PC-0123",
    "os_name": "Microsoft Windows 11 Pro",
    "os_version": "10.0.22631",
    "os_build": "22631",
    "firmware_version": "1.14.0",
    "chip_name": null
  },
  "cpus": [
    {
      "manufacturer": "GenuineIntel",
      "model": "13th Gen Intel(R) Core(TM) i5-13500",
      "cores": 14,
      "threads": 20,
      "base_speed_mhz": 2500,
      "is_integrated": false
    }
  ],
  "memory": {
    "total_bytes": 17179869184,
    "is_integrated": false,
    "modules": [
      { "slot": "DIMM1", "manufacturer": "SK Hynix", "size_bytes": 8589934592, "speed_mhz": 3200, "part_number": "HMA81GU6DJR8N-XN", "serial_number": "SAMPLE01" },
      { "slot": "DIMM2", "manufacturer": "SK Hynix", "size_bytes": 8589934592, "speed_mhz": 3200, "part_number": "HMA81GU6DJR8N-XN", "serial_number": "SAMPLE02" }
    ]
  },
  "storage": [
    { "model": "SAMSUNG MZVL2512HCJQ-00BD1", "serial_number": "SAMPLE-NVME-0001", "size_bytes": 512110190592, "media_type": "ssd", "bus_type": "NVMe", "is_internal": true, "is_integrated": false },
    { "model": "ST1000DM010-2EP102", "serial_number": "SAMPLE-HDD-0001", "size_bytes": 1000204886016, "media_type": "hdd", "bus_type": "SATA", "is_internal": true, "is_integrated": false }
  ],
  "volumes": [
    { "mount_point": "C:", "label": "OS", "filesystem": "NTFS", "size_bytes": 510770802688, "free_bytes": 312475926528 },
    { "mount_point": "D:", "label": "Data", "filesystem": "NTFS", "size_bytes": 1000202039296, "free_bytes": 850123456512 }
  ],
  "motherboard": { "manufacturer": "Dell Inc.", "product": "0N4R2J", "serial_number": "/SAMPLE7X/CNPEC0012345/" },
  "gpus": [
    { "name": "Intel(R) UHD Graphics 770", "memory_bytes": 1073741824, "driver_version": "31.0.101.4502", "is_integrated": true }
  ],
  "network": {
    "adapters": [
      { "name": "Intel(R) Ethernet Connection (17) I219-LM", "mac_address": "D0:8E:79:00:00:01", "type": "ethernet", "is_physical": true, "ip_addresses": ["10.20.30.123", "fe80::1c2d:3e4f:5a6b:7c8d"], "gateway": "10.20.30.1", "dns_servers": ["10.20.0.10", "10.20.0.11"], "dhcp_enabled": true },
      { "name": "Intel(R) Wi-Fi 6E AX211 160MHz", "mac_address": "70:A8:D3:00:00:02", "type": "wifi", "is_physical": true, "ip_addresses": [], "gateway": null, "dns_servers": [], "dhcp_enabled": true }
    ],
    "wifi_ssid": null
  }
}
